{
  "schemaVersion": "laidies-content-artifact-manifest.v1",
  "candidateId": "congress-ai-oversight-response-20260915",
  "surface": "NEWSSTAND_DAILY",
  "contentClass": "NEWS",
  "reviewText": {
    "path": "operations/product-stewards/newsstand/candidates/congress-ai-oversight-response-20260915/review-text.json",
    "sha256": "8b9739bb671ba75266d67c582f485f1c7b57cdbc2cce51624d27bbce3350baf4"
  },
  "rendered": {
    "path": "operations/product-stewards/newsstand/candidates/congress-ai-oversight-response-20260915/rendered-article.html",
    "sha256": "41198f7dacf3e4b3afebf268f59e7027362c1c085fa33b5df1d8c5be5e417a76"
  }
}
