{
  "schemaVersion": "laidies-content-artifact-manifest.v1",
  "candidateId": "cursor-projects-20260912",
  "surface": "NEWSSTAND_DAILY",
  "contentClass": "NEWS",
  "reviewText": {
    "path": "operations/product-stewards/newsstand/candidates/cursor-projects-20260912/review-text.json",
    "sha256": "32da5c4bc180fe0fe522ca2aba9933f12f43f648100333bd2da3f29eab52347b"
  },
  "rendered": {
    "path": "operations/product-stewards/newsstand/candidates/cursor-projects-20260912/rendered-article.html",
    "sha256": "4c3ddfcf0b6ed6d10e103984bbfe391a8d08d9fcef0d6d8fb1083cf7b4410a4e"
  }
}
