{
  "schemaVersion": "laidies-content-artifact-manifest.v1",
  "candidateId": "NEWSSTAND-PUBLICATION-FORMAT-SAMPLER-V1-20260811",
  "surface": "SUNNYVAiLE NewsStand / internal publication-format sampler",
  "contentClass": "NEWS",
  "reviewText": {
    "path": "operations/product-stewards/newsstand/candidates/publication-format-sampler-v1-2026-08-11.md",
    "sha256": "c2d4265cd006314178f347088df37ebcb3f0529d360c5cf3a4a83a852d0e9262"
  }
}
