{
  "schemaVersion": "laidies-content-artifact-manifest.v1",
  "candidateId": "gemini-live-38-20260915",
  "surface": "NEWSSTAND_DAILY",
  "contentClass": "NEWS",
  "reviewText": {
    "path": "operations/product-stewards/newsstand/candidates/gemini-live-38-20260915/review-text.json",
    "sha256": "2dcb20f77f8b9eac23aa3fba0dd2fe40b8021014080cba9da1e8e1b882e93e52"
  },
  "rendered": {
    "path": "operations/product-stewards/newsstand/candidates/gemini-live-38-20260915/rendered-article.html",
    "sha256": "d36774ea9aeca576c479530a06bce877356b50888055463c37e90c13b3d9dad6"
  }
}
