{
  "schemaVersion": "laidies-content-artifact-manifest.v1",
  "candidateId": "census-ai-graduates-20260915",
  "surface": "NEWSSTAND_DAILY",
  "contentClass": "NEWS",
  "reviewText": {
    "path": "operations/product-stewards/newsstand/candidates/census-ai-graduates-20260915/review-text.json",
    "sha256": "978cef1ac7a622ed7277aacb28c874b0076d7f7acc9de4880daba9ad8a5348b1"
  },
  "rendered": {
    "path": "operations/product-stewards/newsstand/candidates/census-ai-graduates-20260915/rendered-article.html",
    "sha256": "93fbfb0b5b167016edec7785a53d3ae40430f69ea6e92d14e2947376cb8fbda4"
  }
}
